evidence_id	assertion_id	disorder_id	disorder_name	source_file	section	section_index	path	evidence_index	reference	supports	evidence_source	snippet	explanation	raw_json
2498	2310	101	Ehlers-Danlos Syndrome	Ehlers-Danlos_Syndrome.yaml	progression	0	evidence	1	PMID:21193204	SUPPORT		Patients whose first echocardiogram was obtained in late childhood or adulthood were less likely to have aortic dilation (P < .002) than those whose first echocardiogram was obtained in early childhood.	This study suggests that certain clinical findings related to EDS, such as aortic dilation, are more pronounced in childhood, supporting earlier onset and progression.	"{""explanation"": ""This study suggests that certain clinical findings related to EDS, such as aortic dilation, are more pronounced in childhood, supporting earlier onset and progression."", ""reference"": ""PMID:21193204"", ""snippet"": ""Patients whose first echocardiogram was obtained in late childhood or adulthood were less likely to have aortic dilation (P < .002) than those whose first echocardiogram was obtained in early childhood."", ""supports"": ""SUPPORT""}"
2499	2310	101	Ehlers-Danlos Syndrome	Ehlers-Danlos_Syndrome.yaml	progression	0	evidence	2	PMID:24499752	SUPPORT		There is a much greater prevalence of obstetric and gynecologic issues reported by women with Ehlers-Danlos syndrome than in the general population. Additionally, rates differed significantly among the three most common types of Ehlers-Danlos syndrome with vascular type having the highest rates of adverse pregnancy outcomes and menstrual abnormalities.	The study discusses the prevalence of gynecologic and obstetric issues in women with Ehlers-Danlos Syndrome, implying that some symptoms and complications start or can be observed from an early age.	"{""explanation"": ""The study discusses the prevalence of gynecologic and obstetric issues in women with Ehlers-Danlos Syndrome, implying that some symptoms and complications start or can be observed from an early age."", ""reference"": ""PMID:24499752"", ""snippet"": ""There is a much greater prevalence of obstetric and gynecologic issues reported by women with Ehlers-Danlos syndrome than in the general population. Additionally, rates differed significantly among the three most common types of Ehlers-Danlos syndrome with vascular type having the highest rates of adverse pregnancy outcomes and menstrual abnormalities."", ""supports"": ""SUPPORT""}"
2500	2310	101	Ehlers-Danlos Syndrome	Ehlers-Danlos_Syndrome.yaml	progression	0	evidence	3	PMID:29982180	SUPPORT		Arterial fragility is an important characteristic of kyphoscoliotic EDS. It manifests as spontaneous arterial rupture, dissections and dissecting aneurysms which may occur even during early childhood.	This study highlights that arterial fragility in kyphoscoliotic EDS can manifest as early as childhood, supporting the statement regarding early onset and progression of the disease.	"{""explanation"": ""This study highlights that arterial fragility in kyphoscoliotic EDS can manifest as early as childhood, supporting the statement regarding early onset and progression of the disease."", ""reference"": ""PMID:29982180"", ""snippet"": ""Arterial fragility is an important characteristic of kyphoscoliotic EDS. It manifests as spontaneous arterial rupture, dissections and dissecting aneurysms which may occur even during early childhood."", ""supports"": ""SUPPORT""}"
2501	2311	101	Ehlers-Danlos Syndrome	Ehlers-Danlos_Syndrome.yaml	progression	1	evidence	0	PMID:37261967	REFUTE		OBJECTIVE: This review sought to identify studies regarding aging in hEDS/HSD... No study had a stated aim regarding aging in hEDS/HSD, but all studies corroborated earlier natural history studies describing the age-related trajectory of manifestations in younger people. Studies found that symptom progression was heterogeneous, multisystemic, and unpredictable.	The statement that there is a common age range where symptoms peak is refuted by the literature's indication that symptom progression is heterogeneous, multisystemic, and unpredictable.	"{""explanation"": ""The statement that there is a common age range where symptoms peak is refuted by the literature's indication that symptom progression is heterogeneous, multisystemic, and unpredictable."", ""reference"": ""PMID:37261967"", ""snippet"": ""OBJECTIVE: This review sought to identify studies regarding aging in hEDS/HSD... No study had a stated aim regarding aging in hEDS/HSD, but all studies corroborated earlier natural history studies describing the age-related trajectory of manifestations in younger people. Studies found that symptom progression was heterogeneous, multisystemic, and unpredictable."", ""supports"": ""REFUTE""}"
2553	2334	102	Ehlers-Danlos Syndrome, COL5A1-related	Ehlers-Danlos_Syndrome_COL5A1-related.yaml	progression	0	evidence	0	PMID:20847697	PARTIAL		Classic Ehlers-Danlos syndrome is a heritable connective tissue disorder characterized by skin hyperextensibility, fragile and soft skin, delayed wound healing with formation of atrophic scars, easy bruising, and generalized joint hypermobility.	While the COL5A1-related Ehlers-Danlos Syndrome (classic type) is described as a heritable connective tissue disorder with certain clinical features observable from birth, the literature does not specifically detail the age range for the onset of symptoms as 'Birth-20'.	"{""explanation"": ""While the COL5A1-related Ehlers-Danlos Syndrome (classic type) is described as a heritable connective tissue disorder with certain clinical features observable from birth, the literature does not specifically detail the age range for the onset of symptoms as 'Birth-20'."", ""reference"": ""PMID:20847697"", ""snippet"": ""Classic Ehlers-Danlos syndrome is a heritable connective tissue disorder characterized by skin hyperextensibility, fragile and soft skin, delayed wound healing with formation of atrophic scars, easy bruising, and generalized joint hypermobility."", ""supports"": ""PARTIAL""}"
2755	2637	115	Familial Mediterranean Fever	Familial_Mediterranean_Fever.yaml	progression	0	evidence	0	PMID:31999206	SUPPORT		Of 1687 patients, 761 had first FMF attack at </=3 years of age while 926 patients presented with their first manifestation of FMF at >3 years.	The study provides evidence that FMF onset can occur in childhood.	"{""explanation"": ""The study provides evidence that FMF onset can occur in childhood."", ""reference"": ""PMID:31999206"", ""snippet"": ""Of 1687 patients, 761 had first FMF attack at </=3 years of age while 926 patients presented with their first manifestation of FMF at >3 years."", ""supports"": ""SUPPORT""}"
2756	2637	115	Familial Mediterranean Fever	Familial_Mediterranean_Fever.yaml	progression	0	evidence	1	PMID:23194659	SUPPORT		Median age at first symptoms was 4 years (range 3 month-37 years) and at diagnosis 10 years (range 2-44 years).	This reference supports the statement by indicating that the majority of FMF cases have an onset in childhood.	"{""explanation"": ""This reference supports the statement by indicating that the majority of FMF cases have an onset in childhood."", ""reference"": ""PMID:23194659"", ""snippet"": ""Median age at first symptoms was 4 years (range 3 month-37 years) and at diagnosis 10 years (range 2-44 years)."", ""supports"": ""SUPPORT""}"
3596	3605	151	Hepatitis B	Hepatitis_B.yaml	progression	0	evidence	0	PMID:270889	SUPPORT		Fatigue started median 4 weeks, abdominal symptoms median 3 weeks and signs of cholestasis median 2.5 weeks before peak SGPT values were reached.	The study indicates that symptoms of acute hepatitis B, including fatigue and abdominal symptoms, manifest over a period of weeks, supporting the statement.	"{""explanation"": ""The study indicates that symptoms of acute hepatitis B, including fatigue and abdominal symptoms, manifest over a period of weeks, supporting the statement."", ""reference"": ""PMID:270889"", ""snippet"": ""Fatigue started median 4 weeks, abdominal symptoms median 3 weeks and signs of cholestasis median 2.5 weeks before peak SGPT values were reached."", ""supports"": ""SUPPORT""}"
3597	3605	151	Hepatitis B	Hepatitis_B.yaml	progression	0	evidence	1	PMID:3967850	SUPPORT		The median follow-up time was 8 months (range, 1 week to 3 years). HBV DNA was detected in 26 (34%) patients on admission to the hospital.	This reference suggests that acute hepatitis B can have a duration ranging from weeks to several months, aligning with the statement.	"{""explanation"": ""This reference suggests that acute hepatitis B can have a duration ranging from weeks to several months, aligning with the statement."", ""reference"": ""PMID:3967850"", ""snippet"": ""The median follow-up time was 8 months (range, 1 week to 3 years). HBV DNA was detected in 26 (34%) patients on admission to the hospital."", ""supports"": ""SUPPORT""}"
3598	3606	151	Hepatitis B	Hepatitis_B.yaml	progression	1	evidence	0	PMID:18067957	SUPPORT		The knowledge of the HBV organization and replication cycle and the availability of sensitive HBV-DNA assays have led to remarkable progress in our understanding of the natural history of chronic hepatitis B infections.	The reference discusses the natural history of chronic hepatitis B infections, implying a prolonged duration.	"{""explanation"": ""The reference discusses the natural history of chronic hepatitis B infections, implying a prolonged duration."", ""reference"": ""PMID:18067957"", ""snippet"": ""The knowledge of the HBV organization and replication cycle and the availability of sensitive HBV-DNA assays have led to remarkable progress in our understanding of the natural history of chronic hepatitis B infections."", ""supports"": ""SUPPORT""}"
3599	3606	151	Hepatitis B	Hepatitis_B.yaml	progression	1	evidence	1	PMID:28468285	SUPPORT		Chronic infection with hepatitis B virus (HBV) progresses through multiple phases, including immune tolerant, immune active, immune control, and, in a subset of patients who achieve immune control, reactivation.	The reference outlines the prolonged nature of chronic HBV infection, which can last for years to decades through various phases.	"{""explanation"": ""The reference outlines the prolonged nature of chronic HBV infection, which can last for years to decades through various phases."", ""reference"": ""PMID:28468285"", ""snippet"": ""Chronic infection with hepatitis B virus (HBV) progresses through multiple phases, including immune tolerant, immune active, immune control, and, in a subset of patients who achieve immune control, reactivation."", ""supports"": ""SUPPORT""}"
3600	3606	151	Hepatitis B	Hepatitis_B.yaml	progression	1	evidence	2	PMID:21205148	SUPPORT		Chronic hepatitis B virus (HBV) infection is a dynamic series of interactions between HBV, hepatocytes and the patient's immune system. HBV replication is the key motor of disease progression, including the development of cirrhosis and hepatocellular carcinoma (HCC).	The reference indicates the long-term nature of chronic HBV infection and its potential to lead to serious liver conditions over time.	"{""explanation"": ""The reference indicates the long-term nature of chronic HBV infection and its potential to lead to serious liver conditions over time."", ""reference"": ""PMID:21205148"", ""snippet"": ""Chronic hepatitis B virus (HBV) infection is a dynamic series of interactions between HBV, hepatocytes and the patient's immune system. HBV replication is the key motor of disease progression, including the development of cirrhosis and hepatocellular carcinoma (HCC)."", ""supports"": ""SUPPORT""}"
3601	3606	151	Hepatitis B	Hepatitis_B.yaml	progression	1	evidence	3	PMID:12616451	SUPPORT		Many HBV-infected children have normal alanine aminotransferase values and minimal chronic hepatitis. Children with chronic HBV infection are usually asymptomatic but may develop chronic liver disease or hepatocellular carcinoma.	The reference highlights that chronic HBV infection can last for a long duration, potentially leading to serious liver conditions.	"{""explanation"": ""The reference highlights that chronic HBV infection can last for a long duration, potentially leading to serious liver conditions."", ""reference"": ""PMID:12616451"", ""snippet"": ""Many HBV-infected children have normal alanine aminotransferase values and minimal chronic hepatitis. Children with chronic HBV infection are usually asymptomatic but may develop chronic liver disease or hepatocellular carcinoma."", ""supports"": ""SUPPORT""}"
3602	3606	151	Hepatitis B	Hepatitis_B.yaml	progression	1	evidence	4	PMID:6994954	SUPPORT		Fewer than 10% of cases of acute icteric HBV become chronic, but chronicity is more common after anicteric infections. The prognosis for chronic persistent hepatitis B is usually good whereas many cases of chronic active hepatitis B will progress to cirrhosis although the time scale may be long.	The reference supports the statement by indicating that chronic HBV infection can last for years to decades, with potential progression to cirrhosis.	"{""explanation"": ""The reference supports the statement by indicating that chronic HBV infection can last for years to decades, with potential progression to cirrhosis."", ""reference"": ""PMID:6994954"", ""snippet"": ""Fewer than 10% of cases of acute icteric HBV become chronic, but chronicity is more common after anicteric infections. The prognosis for chronic persistent hepatitis B is usually good whereas many cases of chronic active hepatitis B will progress to cirrhosis although the time scale may be long."", ""supports"": ""SUPPORT""}"
3603	3607	151	Hepatitis B	Hepatitis_B.yaml	progression	2	evidence	0	PMID:18067957	SUPPORT		The knowledge of the HBV organization and replication cycle and the availability of sensitive HBV-DNA assays have led to remarkable progress in our understanding of the natural history of chronic hepatitis B infections.	The statement is supported as it mentions the natural history of chronic hepatitis B infections, which implies variability in the duration of the infection.	"{""explanation"": ""The statement is supported as it mentions the natural history of chronic hepatitis B infections, which implies variability in the duration of the infection."", ""reference"": ""PMID:18067957"", ""snippet"": ""The knowledge of the HBV organization and replication cycle and the availability of sensitive HBV-DNA assays have led to remarkable progress in our understanding of the natural history of chronic hepatitis B infections."", ""supports"": ""SUPPORT""}"
3604	3607	151	Hepatitis B	Hepatitis_B.yaml	progression	2	evidence	1	PMID:33545773	SUPPORT		Patients with chronic HBV infection and an excessive drinking habit activate HBV-DNA which increases liver inflammation, thus accelerating the progress of liver cirrhosis.	This reference supports the statement as it discusses the progression of chronic HBV infection to liver cirrhosis, indicating a variable duration of the disease progression depending on external factors like alcohol intake.	"{""explanation"": ""This reference supports the statement as it discusses the progression of chronic HBV infection to liver cirrhosis, indicating a variable duration of the disease progression depending on external factors like alcohol intake."", ""reference"": ""PMID:33545773"", ""snippet"": ""Patients with chronic HBV infection and an excessive drinking habit activate HBV-DNA which increases liver inflammation, thus accelerating the progress of liver cirrhosis."", ""supports"": ""SUPPORT""}"
3605	3607	151	Hepatitis B	Hepatitis_B.yaml	progression	2	evidence	2	PMID:33029534	SUPPORT		Liver-function decompensation or hepatocellular carcinoma (HCC) gradually appears after chronic hepatitis B progresses to cirrhosis.	The reference supports the statement by indicating that chronic hepatitis B can progress to cirrhosis, which aligns with the note about chronic infection causing liver scarring and dysfunction.	"{""explanation"": ""The reference supports the statement by indicating that chronic hepatitis B can progress to cirrhosis, which aligns with the note about chronic infection causing liver scarring and dysfunction."", ""reference"": ""PMID:33029534"", ""snippet"": ""Liver-function decompensation or hepatocellular carcinoma (HCC) gradually appears after chronic hepatitis B progresses to cirrhosis."", ""supports"": ""SUPPORT""}"
3606	3607	151	Hepatitis B	Hepatitis_B.yaml	progression	2	evidence	3	PMID:32147592	SUPPORT		In a longitudinal study of patients with chronic HBV infection, we associated liver fibrosis progression at week 78 of treatment with higher rates of detected HBV DNA.	This reference supports the statement by discussing the progression of fibrosis in chronic HBV infection, indicating variability in disease duration.	"{""explanation"": ""This reference supports the statement by discussing the progression of fibrosis in chronic HBV infection, indicating variability in disease duration."", ""reference"": ""PMID:32147592"", ""snippet"": ""In a longitudinal study of patients with chronic HBV infection, we associated liver fibrosis progression at week 78 of treatment with higher rates of detected HBV DNA."", ""supports"": ""SUPPORT""}"
3607	3607	151	Hepatitis B	Hepatitis_B.yaml	progression	2	evidence	4	PMID:25253946	SUPPORT		The histological end points of CAH are chronic inflammation, fibrosis and cirrhosis which are coupled with increased DNA synthesis in cirrhotic vs healthy normal livers.	The reference supports the statement by describing the progression of chronic active hepatitis (CAH) to cirrhosis, indicating variability in the duration of disease progression.	"{""explanation"": ""The reference supports the statement by describing the progression of chronic active hepatitis (CAH) to cirrhosis, indicating variability in the duration of disease progression."", ""reference"": ""PMID:25253946"", ""snippet"": ""The histological end points of CAH are chronic inflammation, fibrosis and cirrhosis which are coupled with increased DNA synthesis in cirrhotic vs healthy normal livers."", ""supports"": ""SUPPORT""}"
3608	3608	151	Hepatitis B	Hepatitis_B.yaml	progression	3	evidence	0	PMID:20378277	SUPPORT		Chronic HBV infection is the most prevalent cause of this tumour, accounting for 55% of global cases, and 89% of those in endemic regions for HBV infection.	The literature clearly states that chronic HBV infection significantly increases the risk of hepatocellular carcinoma (HCC).	"{""explanation"": ""The literature clearly states that chronic HBV infection significantly increases the risk of hepatocellular carcinoma (HCC)."", ""reference"": ""PMID:20378277"", ""snippet"": ""Chronic HBV infection is the most prevalent cause of this tumour, accounting for 55% of global cases, and 89% of those in endemic regions for HBV infection."", ""supports"": ""SUPPORT""}"
3609	3608	151	Hepatitis B	Hepatitis_B.yaml	progression	3	evidence	1	PMID:31450890	SUPPORT		Our study revealed that HBsAg levels >/= 100 IU/ml, and notably >1,000 IU/ ml, are associated with an increased risk of HCC development.	The study shows that higher levels of hepatitis B surface antigen, which is indicative of chronic HBV infection, are associated with an increased risk of liver cancer.	"{""explanation"": ""The study shows that higher levels of hepatitis B surface antigen, which is indicative of chronic HBV infection, are associated with an increased risk of liver cancer."", ""reference"": ""PMID:31450890"", ""snippet"": ""Our study revealed that HBsAg levels >/= 100 IU/ml, and notably >1,000 IU/ ml, are associated with an increased risk of HCC development."", ""supports"": ""SUPPORT""}"
3610	3608	151	Hepatitis B	Hepatitis_B.yaml	progression	3	evidence	2	PMID:19399792	SUPPORT		The primary adverse outcomes of chronic HBV infection are hepatocellular carcinoma (HCC) and cirrhosis.	This reference confirms that chronic HBV infection significantly increases the risk of developing hepatocellular carcinoma.	"{""explanation"": ""This reference confirms that chronic HBV infection significantly increases the risk of developing hepatocellular carcinoma."", ""reference"": ""PMID:19399792"", ""snippet"": ""The primary adverse outcomes of chronic HBV infection are hepatocellular carcinoma (HCC) and cirrhosis."", ""supports"": ""SUPPORT""}"
3611	3608	151	Hepatitis B	Hepatitis_B.yaml	progression	3	evidence	3	PMID:32931613	SUPPORT		Hepatitis B virus (HBV) is a major cause of chronic liver disease, which can progress to cirrhosis, hepatocellular carcinoma, and death.	The literature indicates that chronic HBV infection can lead to hepatocellular carcinoma, supporting the statement.	"{""explanation"": ""The literature indicates that chronic HBV infection can lead to hepatocellular carcinoma, supporting the statement."", ""reference"": ""PMID:32931613"", ""snippet"": ""Hepatitis B virus (HBV) is a major cause of chronic liver disease, which can progress to cirrhosis, hepatocellular carcinoma, and death."", ""supports"": ""SUPPORT""}"
3730	3735	156	Hirschsprung Disease	Hirschsprung_Disease.yaml	progression	0	evidence	0	PMID:2039180	SUPPORT		Hirschsprung disease has become a neonatal diagnosis. Most cases identified now are children who would previously have died before the diagnosis of their condition which was usually established only after the age of two.	The literature states that Hirschsprung's disease is typically diagnosed during the neonatal phase, supporting the statement.	"{""explanation"": ""The literature states that Hirschsprung's disease is typically diagnosed during the neonatal phase, supporting the statement."", ""reference"": ""PMID:2039180"", ""snippet"": ""Hirschsprung disease has become a neonatal diagnosis. Most cases identified now are children who would previously have died before the diagnosis of their condition which was usually established only after the age of two."", ""supports"": ""SUPPORT""}"
3731	3735	156	Hirschsprung Disease	Hirschsprung_Disease.yaml	progression	0	evidence	1	PMID:4060039	SUPPORT		This review of Hirschsprung's disease reflects the authors' experience with it and outlines the current recommendations for management of its various manifestations.	While the abstract does not explicitly specify the neonatal phase, it mentions current management practices and experiences, implying early diagnosis and treatment.	"{""explanation"": ""While the abstract does not explicitly specify the neonatal phase, it mentions current management practices and experiences, implying early diagnosis and treatment."", ""reference"": ""PMID:4060039"", ""snippet"": ""This review of Hirschsprung's disease reflects the authors' experience with it and outlines the current recommendations for management of its various manifestations."", ""supports"": ""SUPPORT""}"
3732	3735	156	Hirschsprung Disease	Hirschsprung_Disease.yaml	progression	0	evidence	2	PMID:25066220	SUPPORT		Hirschsprung's disease is a congenital gut motility disorder, characterised by the absence of the enteric ganglion cells along the distal gut.	Although this does not explicitly state the neonatal onset, congenital disorders are typically identified at birth or soon after, thus supporting the statement indirectly.	"{""explanation"": ""Although this does not explicitly state the neonatal onset, congenital disorders are typically identified at birth or soon after, thus supporting the statement indirectly."", ""reference"": ""PMID:25066220"", ""snippet"": ""Hirschsprung's disease is a congenital gut motility disorder, characterised by the absence of the enteric ganglion cells along the distal gut."", ""supports"": ""SUPPORT""}"
3944	3837	160	Hypertensive Heart Disease	Hypertensive_Heart_Disease.yaml	progression	0	evidence	0	PMID:38596912	SUPPORT		This study documents the point prevalence of subclinical heart disease in emergency patients with asymptomatic hypertension.	This reference supports the statement for the asymptomatic phase by documenting the presence of subclinical heart disease in patients with asymptomatic hypertension, which aligns with the concept of progression in hypertensive heart disease, but it does not focus specifically on the age range of 40-60.	"{""explanation"": ""This reference supports the statement for the asymptomatic phase by documenting the presence of subclinical heart disease in patients with asymptomatic hypertension, which aligns with the concept of progression in hypertensive heart disease, but it does not focus specifically on the age range of 40-60."", ""reference"": ""PMID:38596912"", ""snippet"": ""This study documents the point prevalence of subclinical heart disease in emergency patients with asymptomatic hypertension."", ""supports"": ""SUPPORT""}"
3945	3838	160	Hypertensive Heart Disease	Hypertensive_Heart_Disease.yaml	progression	1	evidence	0	PMID:21263005	PARTIAL		The progression of hypertensive heart disease.	The reference discusses the progression of hypertensive heart disease but does not specify the age range of 50-80 or the phase as symptomatic.	"{""explanation"": ""The reference discusses the progression of hypertensive heart disease but does not specify the age range of 50-80 or the phase as symptomatic."", ""reference"": ""PMID:21263005"", ""snippet"": ""The progression of hypertensive heart disease."", ""supports"": ""PARTIAL""}"
