evidence_id	assertion_id	disorder_id	disorder_name	source_file	section	section_index	path	evidence_index	reference	supports	evidence_source	snippet	explanation	raw_json
4958	4865	205	Meckel Diverticulum	Meckel_Diverticulum.yaml	progression	0	evidence	2	PMID:15026601	SUPPORT		Sixty percent of patients come to medical attention before 10 years of age, with the remainder of cases manifesting in adolescence and adulthood.	This documents the age distribution of symptomatic presentations.	"{""explanation"": ""This documents the age distribution of symptomatic presentations."", ""reference"": ""PMID:15026601"", ""snippet"": ""Sixty percent of patients come to medical attention before 10 years of age, with the remainder of cases manifesting in adolescence and adulthood."", ""supports"": ""SUPPORT""}"
5093	5009	210	Melanoma_in_Congenital_Melanocytic_Nevus	Melanoma_in_Congenital_Melanocytic_Nevus.yaml	progression	0	evidence	0	PMID:28785360	SUPPORT		Although not common, the possible malignant transformation remains one of the most important considerations related to them, as the related lifetime risk of melanoma is 4% to 10%.	The abstract discusses the risk of melanoma in congenital melanocytic nevi occurring from childhood to adulthood, supporting the statement.	"{""explanation"": ""The abstract discusses the risk of melanoma in congenital melanocytic nevi occurring from childhood to adulthood, supporting the statement."", ""reference"": ""PMID:28785360"", ""snippet"": ""Although not common, the possible malignant transformation remains one of the most important considerations related to them, as the related lifetime risk of melanoma is 4% to 10%."", ""supports"": ""SUPPORT""}"
5412	5240	219	Multiple Sclerosis	Multiple_Sclerosis.yaml	progression	0	evidence	0	PMID:25997994	SUPPORT		Relapses (episodic exacerbations of neurological signs or symptoms) are a defining feature of relapsing-remitting multiple sclerosis (MS), the most prevalent MS phenotype.	The abstract clearly states that relapses are a defining feature of relapsing-remitting MS, supporting the statement about periods of neurological symptoms followed by partial or complete recovery.	"{""explanation"": ""The abstract clearly states that relapses are a defining feature of relapsing-remitting MS, supporting the statement about periods of neurological symptoms followed by partial or complete recovery."", ""reference"": ""PMID:25997994"", ""snippet"": ""Relapses (episodic exacerbations of neurological signs or symptoms) are a defining feature of relapsing-remitting multiple sclerosis (MS), the most prevalent MS phenotype."", ""supports"": ""SUPPORT""}"
5413	5240	219	Multiple Sclerosis	Multiple_Sclerosis.yaml	progression	0	evidence	1	PMID:34006674	SUPPORT		The relapsing-remitting type is a major clinical course in MS.	This reference confirms that the relapsing-remitting type is a major clinical course in MS, aligning with the statement about periods of relapses and remissions.	"{""explanation"": ""This reference confirms that the relapsing-remitting type is a major clinical course in MS, aligning with the statement about periods of relapses and remissions."", ""reference"": ""PMID:34006674"", ""snippet"": ""The relapsing-remitting type is a major clinical course in MS."", ""supports"": ""SUPPORT""}"
5414	5240	219	Multiple Sclerosis	Multiple_Sclerosis.yaml	progression	0	evidence	2	PMID:31971066	SUPPORT		Cognitive impairment is common in multiple sclerosis (MS) but its manifestation as acute disease activity is underappreciated... In RG patients, SDMT declined from 55.2 to 44.6 at relapse and recovered to 51.7.	This study highlights cognitive function decline during relapses and subsequent recovery, supporting the characterization of MS by periods of neurological symptoms followed by recovery.	"{""explanation"": ""This study highlights cognitive function decline during relapses and subsequent recovery, supporting the characterization of MS by periods of neurological symptoms followed by recovery."", ""reference"": ""PMID:31971066"", ""snippet"": ""Cognitive impairment is common in multiple sclerosis (MS) but its manifestation as acute disease activity is underappreciated... In RG patients, SDMT declined from 55.2 to 44.6 at relapse and recovered to 51.7."", ""supports"": ""SUPPORT""}"
5415	5241	219	Multiple Sclerosis	Multiple_Sclerosis.yaml	progression	1	evidence	0	PMID:16545751	SUPPORT		The secondary progressive phase of multiple sclerosis (MS), which is characterised by a steady accrual of fixed disability after an initial relapsing remitting course, is not clearly understood.	The reference describes secondary progressive MS as a phase that follows an initial relapsing-remitting course and is characterized by progressive worsening of neurological function.	"{""explanation"": ""The reference describes secondary progressive MS as a phase that follows an initial relapsing-remitting course and is characterized by progressive worsening of neurological function."", ""reference"": ""PMID:16545751"", ""snippet"": ""The secondary progressive phase of multiple sclerosis (MS), which is characterised by a steady accrual of fixed disability after an initial relapsing remitting course, is not clearly understood."", ""supports"": ""SUPPORT""}"
5416	5241	219	Multiple Sclerosis	Multiple_Sclerosis.yaml	progression	1	evidence	1	PMID:20946934	SUPPORT		This transforms into a disease of continuous and irreversible neurological decline by the sixth or seventh decade.	The reference supports the statement by describing the transition from an initial phase with reversible episodes to a phase of continuous and irreversible neurological decline.	"{""explanation"": ""The reference supports the statement by describing the transition from an initial phase with reversible episodes to a phase of continuous and irreversible neurological decline."", ""reference"": ""PMID:20946934"", ""snippet"": ""This transforms into a disease of continuous and irreversible neurological decline by the sixth or seventh decade."", ""supports"": ""SUPPORT""}"
5417	5241	219	Multiple Sclerosis	Multiple_Sclerosis.yaml	progression	1	evidence	2	PMID:24722325	SUPPORT		The predominant clinical disease course of multiple sclerosis starts with reversible episodes of neurological disability, which transforms into progressive neurological decline.	The reference supports the statement by describing the progression from relapsing episodes to a phase of progressive neurological decline.	"{""explanation"": ""The reference supports the statement by describing the progression from relapsing episodes to a phase of progressive neurological decline."", ""reference"": ""PMID:24722325"", ""snippet"": ""The predominant clinical disease course of multiple sclerosis starts with reversible episodes of neurological disability, which transforms into progressive neurological decline."", ""supports"": ""SUPPORT""}"
5418	5242	219	Multiple Sclerosis	Multiple_Sclerosis.yaml	progression	2	evidence	0	PMID:33578205	SUPPORT		Patients with primary progressive multiple sclerosis (PPMS) vary in the rate of disability progression.	The statement describes a gradual progression of disability from onset without early relapses and remissions, which aligns with the characteristics of primary progressive MS (PPMS).	"{""explanation"": ""The statement describes a gradual progression of disability from onset without early relapses and remissions, which aligns with the characteristics of primary progressive MS (PPMS)."", ""reference"": ""PMID:33578205"", ""snippet"": ""Patients with primary progressive multiple sclerosis (PPMS) vary in the rate of disability progression."", ""supports"": ""SUPPORT""}"
5419	5242	219	Multiple Sclerosis	Multiple_Sclerosis.yaml	progression	2	evidence	1	PMID:35977131	SUPPORT		Types of MS include relapsing-remitting (most common), secondary progressive, and primary progressive.	This reference supports the classification of MS into types, including primary progressive MS, which is characterized by a gradual progression of disability from onset without early relapses and remissions.	"{""explanation"": ""This reference supports the classification of MS into types, including primary progressive MS, which is characterized by a gradual progression of disability from onset without early relapses and remissions."", ""reference"": ""PMID:35977131"", ""snippet"": ""Types of MS include relapsing-remitting (most common), secondary progressive, and primary progressive."", ""supports"": ""SUPPORT""}"
5420	5242	219	Multiple Sclerosis	Multiple_Sclerosis.yaml	progression	2	evidence	2	PMID:29157397	SUPPORT		Subclinical activity in radiologically isolated syndrome evolving to primary-progressive MS is mostly indistinguishable from relapsing-remitting MS evolving to secondary-progressive MS.	This reference supports the concept of primary progressive MS, which involves a gradual progression of disability without the early relapses and remissions seen in relapsing-remitting MS.	"{""explanation"": ""This reference supports the concept of primary progressive MS, which involves a gradual progression of disability without the early relapses and remissions seen in relapsing-remitting MS."", ""reference"": ""PMID:29157397"", ""snippet"": ""Subclinical activity in radiologically isolated syndrome evolving to primary-progressive MS is mostly indistinguishable from relapsing-remitting MS evolving to secondary-progressive MS."", ""supports"": ""SUPPORT""}"
5421	5243	219	Multiple Sclerosis	Multiple_Sclerosis.yaml	progression	3	evidence	0	PMID:37068931	NO_EVIDENCE		BACKGROUND: Some studies comparing primary and secondary progressive multiple sclerosis (PPMS, SPMS) report similar ages at onset of the progressive phase and similar rates of subsequent disability accrual. Others report later onset and/or faster accrual in SPMS.	The reference discusses primary and secondary progressive multiple sclerosis but does not mention progressive-relapsing multiple sclerosis (PRMS).	"{""explanation"": ""The reference discusses primary and secondary progressive multiple sclerosis but does not mention progressive-relapsing multiple sclerosis (PRMS)."", ""reference"": ""PMID:37068931"", ""snippet"": ""BACKGROUND: Some studies comparing primary and secondary progressive multiple sclerosis (PPMS, SPMS) report similar ages at onset of the progressive phase and similar rates of subsequent disability accrual. Others report later onset and/or faster accrual in SPMS."", ""supports"": ""NO_EVIDENCE""}"
5422	5243	219	Multiple Sclerosis	Multiple_Sclerosis.yaml	progression	3	evidence	1	PMID:17884680	NO_EVIDENCE		About 10-15% of patients with multiple sclerosis (MS) present with gradually increasing neurological disability, a disorder known as primary-progressive multiple sclerosis (PPMS).	This reference focuses on primary-progressive multiple sclerosis (PPMS) and does not address progressive-relapsing multiple sclerosis (PRMS).	"{""explanation"": ""This reference focuses on primary-progressive multiple sclerosis (PPMS) and does not address progressive-relapsing multiple sclerosis (PRMS)."", ""reference"": ""PMID:17884680"", ""snippet"": ""About 10-15% of patients with multiple sclerosis (MS) present with gradually increasing neurological disability, a disorder known as primary-progressive multiple sclerosis (PPMS)."", ""supports"": ""NO_EVIDENCE""}"
5423	5243	219	Multiple Sclerosis	Multiple_Sclerosis.yaml	progression	3	evidence	2	PMID:31397221	NO_EVIDENCE		BACKGROUND: The risk factors for conversion from relapsing-remitting to secondary progressive multiple sclerosis remain highly contested.	The reference discusses the transition from relapsing-remitting to secondary progressive multiple sclerosis but does not mention progressive-relapsing multiple sclerosis (PRMS).	"{""explanation"": ""The reference discusses the transition from relapsing-remitting to secondary progressive multiple sclerosis but does not mention progressive-relapsing multiple sclerosis (PRMS)."", ""reference"": ""PMID:31397221"", ""snippet"": ""BACKGROUND: The risk factors for conversion from relapsing-remitting to secondary progressive multiple sclerosis remain highly contested."", ""supports"": ""NO_EVIDENCE""}"
5424	5243	219	Multiple Sclerosis	Multiple_Sclerosis.yaml	progression	3	evidence	3	PMID:11207871	NO_EVIDENCE		Late-onset MS was defined as the first presentation of clinical symptoms after the age of 50 years.	The reference discusses late-onset multiple sclerosis but does not specifically address progressive-relapsing multiple sclerosis (PRMS).	"{""explanation"": ""The reference discusses late-onset multiple sclerosis but does not specifically address progressive-relapsing multiple sclerosis (PRMS)."", ""reference"": ""PMID:11207871"", ""snippet"": ""Late-onset MS was defined as the first presentation of clinical symptoms after the age of 50 years."", ""supports"": ""NO_EVIDENCE""}"
5425	5243	219	Multiple Sclerosis	Multiple_Sclerosis.yaml	progression	3	evidence	4	PMID:24722325	NO_EVIDENCE		The clinical course of multiple sclerosis is variable, and the disease can be classified into relapsing and progressive phases.	The reference distinguishes between relapsing and progressive phases of multiple sclerosis but does not specifically mention progressive-relapsing multiple sclerosis (PRMS).	"{""explanation"": ""The reference distinguishes between relapsing and progressive phases of multiple sclerosis but does not specifically mention progressive-relapsing multiple sclerosis (PRMS)."", ""reference"": ""PMID:24722325"", ""snippet"": ""The clinical course of multiple sclerosis is variable, and the disease can be classified into relapsing and progressive phases."", ""supports"": ""NO_EVIDENCE""}"
5508	5290	220	Multisystem Inflammatory Syndrome in Children (MIS-C)	Multisystem_Inflammatory_Syndrome_in_Children_MIS-C.yaml	progression	0	evidence	0	PMID:36881797	PARTIAL		Multisystem inflammatory disease in children (MIS-C) is a condition typically seen 3 to 6 weeks after acute infection with severe acute respiratory syndrome coronavirus 2 (SARS-CoV-2).	The reference supports the timing of onset (2-6 weeks after COVID-19 infection) but does not specify the age range 0-21. It mentions children, which generally refers to individuals under 18.	"{""explanation"": ""The reference supports the timing of onset (2-6 weeks after COVID-19 infection) but does not specify the age range 0-21. It mentions children, which generally refers to individuals under 18."", ""reference"": ""PMID:36881797"", ""snippet"": ""Multisystem inflammatory disease in children (MIS-C) is a condition typically seen 3 to 6 weeks after acute infection with severe acute respiratory syndrome coronavirus 2 (SARS-CoV-2)."", ""supports"": ""PARTIAL""}"
5509	5290	220	Multisystem Inflammatory Syndrome in Children (MIS-C)	Multisystem_Inflammatory_Syndrome_in_Children_MIS-C.yaml	progression	0	evidence	1	PMID:35288706	NO_EVIDENCE		Comparing paediatric COVID-19 with MIS-C.	The title suggests a comparison study but does not provide specific evidence related to the age range or onset timing.	"{""explanation"": ""The title suggests a comparison study but does not provide specific evidence related to the age range or onset timing."", ""reference"": ""PMID:35288706"", ""snippet"": ""Comparing paediatric COVID-19 with MIS-C."", ""supports"": ""NO_EVIDENCE""}"
5510	5290	220	Multisystem Inflammatory Syndrome in Children (MIS-C)	Multisystem_Inflammatory_Syndrome_in_Children_MIS-C.yaml	progression	0	evidence	2	PMID:34311990	PARTIAL		Nevertheless, cases of severe disease or a post-infectious multisystem hyperinflammatory syndrome named multisystem inflammatory syndrome in children (MIS-C) have been described.	The reference mentions MIS-C as a post-infectious condition but does not specify the age range 0-21 or the exact timing of onset.	"{""explanation"": ""The reference mentions MIS-C as a post-infectious condition but does not specify the age range 0-21 or the exact timing of onset."", ""reference"": ""PMID:34311990"", ""snippet"": ""Nevertheless, cases of severe disease or a post-infectious multisystem hyperinflammatory syndrome named multisystem inflammatory syndrome in children (MIS-C) have been described."", ""supports"": ""PARTIAL""}"
5511	5290	220	Multisystem Inflammatory Syndrome in Children (MIS-C)	Multisystem_Inflammatory_Syndrome_in_Children_MIS-C.yaml	progression	0	evidence	3	PMID:37142896	PARTIAL		Children may develop a specific complication of COVID-19 called multisystem inflammatory syndrome in children (MIS-C) which could influence the vascular system of children and cause multiple coagulopathies in the body.	The reference supports the occurrence of MIS-C in children but does not specify the age range 0-21 or the exact timing of onset.	"{""explanation"": ""The reference supports the occurrence of MIS-C in children but does not specify the age range 0-21 or the exact timing of onset."", ""reference"": ""PMID:37142896"", ""snippet"": ""Children may develop a specific complication of COVID-19 called multisystem inflammatory syndrome in children (MIS-C) which could influence the vascular system of children and cause multiple coagulopathies in the body."", ""supports"": ""PARTIAL""}"
5512	5290	220	Multisystem Inflammatory Syndrome in Children (MIS-C)	Multisystem_Inflammatory_Syndrome_in_Children_MIS-C.yaml	progression	0	evidence	4	PMID:32525700	PARTIAL		Multisystem Inflammatory Syndrome in Children in Association With COVID-19.	The title suggests an association with COVID-19 but does not provide specific details on the age range or timing of onset.	"{""explanation"": ""The title suggests an association with COVID-19 but does not provide specific details on the age range or timing of onset."", ""reference"": ""PMID:32525700"", ""snippet"": ""Multisystem Inflammatory Syndrome in Children in Association With COVID-19."", ""supports"": ""PARTIAL""}"
5513	5290	220	Multisystem Inflammatory Syndrome in Children (MIS-C)	Multisystem_Inflammatory_Syndrome_in_Children_MIS-C.yaml	progression	0	evidence	5	PMID:35258639	PARTIAL		Multisystem inflammatory syndrome in children occurs weeks after initial infection with SARS-CoV-2 and can be associated with severe cardiovascular complications and death.	The reference supports the timing of onset (weeks after infection) but does not specify the age range 0-21.	"{""explanation"": ""The reference supports the timing of onset (weeks after infection) but does not specify the age range 0-21."", ""reference"": ""PMID:35258639"", ""snippet"": ""Multisystem inflammatory syndrome in children occurs weeks after initial infection with SARS-CoV-2 and can be associated with severe cardiovascular complications and death."", ""supports"": ""PARTIAL""}"
5514	5290	220	Multisystem Inflammatory Syndrome in Children (MIS-C)	Multisystem_Inflammatory_Syndrome_in_Children_MIS-C.yaml	progression	0	evidence	6	PMID:35183528	PARTIAL		Since the COVID-19 pandemic began, a cohort of Multisystem inflammatory syndrome in children (MIS-C) patients has been described.	The reference mentions MIS-C in children but does not specify the age range 0-21 or the exact timing of onset.	"{""explanation"": ""The reference mentions MIS-C in children but does not specify the age range 0-21 or the exact timing of onset."", ""reference"": ""PMID:35183528"", ""snippet"": ""Since the COVID-19 pandemic began, a cohort of Multisystem inflammatory syndrome in children (MIS-C) patients has been described."", ""supports"": ""PARTIAL""}"
5515	5290	220	Multisystem Inflammatory Syndrome in Children (MIS-C)	Multisystem_Inflammatory_Syndrome_in_Children_MIS-C.yaml	progression	0	evidence	7	PMID:34302327	PARTIAL		We enrolled all hospitalized children aged 1 month - 18 years and diagnosed with either MIS-C and/or dengue fever according to WHO criteria between June and December, 2020.	The reference supports the age range up to 18 years but does not include the full range 0-21 or the timing of onset.	"{""explanation"": ""The reference supports the age range up to 18 years but does not include the full range 0-21 or the timing of onset."", ""reference"": ""PMID:34302327"", ""snippet"": ""We enrolled all hospitalized children aged 1 month - 18 years and diagnosed with either MIS-C and/or dengue fever according to WHO criteria between June and December, 2020."", ""supports"": ""PARTIAL""}"
5516	5290	220	Multisystem Inflammatory Syndrome in Children (MIS-C)	Multisystem_Inflammatory_Syndrome_in_Children_MIS-C.yaml	progression	0	evidence	8	PMID:37054392	PARTIAL		This study, utilizing national data sources, describes the NZ incidence of multisystem inflammatory syndrome in children (MIS-C) following infection with the Omicron variant.	The reference supports the occurrence of MIS-C following COVID-19 infection but does not specify the age range 0-21 or the exact timing of onset.	"{""explanation"": ""The reference supports the occurrence of MIS-C following COVID-19 infection but does not specify the age range 0-21 or the exact timing of onset."", ""reference"": ""PMID:37054392"", ""snippet"": ""This study, utilizing national data sources, describes the NZ incidence of multisystem inflammatory syndrome in children (MIS-C) following infection with the Omicron variant."", ""supports"": ""PARTIAL""}"
5517	5290	220	Multisystem Inflammatory Syndrome in Children (MIS-C)	Multisystem_Inflammatory_Syndrome_in_Children_MIS-C.yaml	progression	0	evidence	9	PMID:33184170	PARTIAL		Multisystem inflammatory syndrome in children (MIS-C) has spread through the pediatric population during the coronavirus disease 2019 pandemic.	The reference supports the occurrence of MIS-C in the pediatric population but does not specify the age range 0-21 or the exact timing of onset.	"{""explanation"": ""The reference supports the occurrence of MIS-C in the pediatric population but does not specify the age range 0-21 or the exact timing of onset."", ""reference"": ""PMID:33184170"", ""snippet"": ""Multisystem inflammatory syndrome in children (MIS-C) has spread through the pediatric population during the coronavirus disease 2019 pandemic."", ""supports"": ""PARTIAL""}"
5803	5598	235	Non-Small Cell Lung Cancer	Non-Small_Cell_Lung_Cancer.yaml	progression	0	evidence	0	PMID:15477641	NO_EVIDENCE		What is clear is that currently over 50% of all patients with non-small cell lung cancer (NSCLC) are 65 years of age or older.	The study mentions the prevalence of NSCLC in patients aged 65 and older, but it does not directly address disease progression specifically in the 60-80 age range at the onset phase.	"{""explanation"": ""The study mentions the prevalence of NSCLC in patients aged 65 and older, but it does not directly address disease progression specifically in the 60-80 age range at the onset phase."", ""reference"": ""PMID:15477641"", ""snippet"": ""What is clear is that currently over 50% of all patients with non-small cell lung cancer (NSCLC) are 65 years of age or older."", ""supports"": ""NO_EVIDENCE""}"
5804	5598	235	Non-Small Cell Lung Cancer	Non-Small_Cell_Lung_Cancer.yaml	progression	0	evidence	1	PMID:20471184	NO_EVIDENCE		To assess rate of disease progression from diagnosis to initiation of treatment for Stage I-IIIB non-small-cell lung cancer (NSCLC).	This study addresses the rate of disease progression from diagnosis to treatment initiation rather than focusing on age-specific progression at onset.	"{""explanation"": ""This study addresses the rate of disease progression from diagnosis to treatment initiation rather than focusing on age-specific progression at onset."", ""reference"": ""PMID:20471184"", ""snippet"": ""To assess rate of disease progression from diagnosis to initiation of treatment for Stage I-IIIB non-small-cell lung cancer (NSCLC)."", ""supports"": ""NO_EVIDENCE""}"
5805	5598	235	Non-Small Cell Lung Cancer	Non-Small_Cell_Lung_Cancer.yaml	progression	0	evidence	2	PMID:38377969	NO_EVIDENCE		The objective of this study was to model multiple sclerosis (MS) disease progression and compare disease trajectories by sex, age of onset, and year of diagnosis.	The study focuses on multiple sclerosis and not on non-small cell lung cancer.	"{""explanation"": ""The study focuses on multiple sclerosis and not on non-small cell lung cancer."", ""reference"": ""PMID:38377969"", ""snippet"": ""The objective of this study was to model multiple sclerosis (MS) disease progression and compare disease trajectories by sex, age of onset, and year of diagnosis."", ""supports"": ""NO_EVIDENCE""}"
5806	5598	235	Non-Small Cell Lung Cancer	Non-Small_Cell_Lung_Cancer.yaml	progression	0	evidence	3	PMID:37681230	NO_EVIDENCE		Adenosquamous carcinoma of the lung is a characteristic tumor that has both adenocarcinoma and squamous cell carcinoma components.	This study focuses on adenosquamous carcinoma and does not address age-specific progression of NSCLC in the 60-80 age range specifically at onset.	"{""explanation"": ""This study focuses on adenosquamous carcinoma and does not address age-specific progression of NSCLC in the 60-80 age range specifically at onset."", ""reference"": ""PMID:37681230"", ""snippet"": ""Adenosquamous carcinoma of the lung is a characteristic tumor that has both adenocarcinoma and squamous cell carcinoma components."", ""supports"": ""NO_EVIDENCE""}"
