evidence_id	assertion_id	disorder_id	disorder_name	source_file	section	section_index	path	evidence_index	reference	supports	evidence_source	snippet	explanation	raw_json
5807	5598	235	Non-Small Cell Lung Cancer	Non-Small_Cell_Lung_Cancer.yaml	progression	0	evidence	4	PMID:34911717	NO_EVIDENCE		To assess clinicopathological predictors and prognosis in early-onset colorectal cancer (CRC) in Lynch syndrome with comparison to patients diagnosed from age 40 and up.	The study is about early-onset colorectal cancer in patients with Lynch syndrome and is not related to NSCLC.	"{""explanation"": ""The study is about early-onset colorectal cancer in patients with Lynch syndrome and is not related to NSCLC."", ""reference"": ""PMID:34911717"", ""snippet"": ""To assess clinicopathological predictors and prognosis in early-onset colorectal cancer (CRC) in Lynch syndrome with comparison to patients diagnosed from age 40 and up."", ""supports"": ""NO_EVIDENCE""}"
5808	5598	235	Non-Small Cell Lung Cancer	Non-Small_Cell_Lung_Cancer.yaml	progression	0	evidence	5	PMID:26729443	NO_EVIDENCE		Non-small-cell lung cancers (NSCLCs) harboring mutations in MET exon 14 and its flanking introns may respond to c-Met inhibitors.	While the study addresses genomic characteristics and treatment responses for NSCLC with MET exon 14 mutations, it does not specifically discuss disease progression at onset in the 60-80 age range.	"{""explanation"": ""While the study addresses genomic characteristics and treatment responses for NSCLC with MET exon 14 mutations, it does not specifically discuss disease progression at onset in the 60-80 age range."", ""reference"": ""PMID:26729443"", ""snippet"": ""Non-small-cell lung cancers (NSCLCs) harboring mutations in MET exon 14 and its flanking introns may respond to c-Met inhibitors."", ""supports"": ""NO_EVIDENCE""}"
5809	5598	235	Non-Small Cell Lung Cancer	Non-Small_Cell_Lung_Cancer.yaml	progression	0	evidence	6	PMID:29432718	NO_EVIDENCE		Among patients with previous lung cancer, the malignant potential of subsequent ground-glass opacities (GGOs) on computed tomography remains unknown.	The study examines ground-glass opacities among patients with a history of lung cancer, not specifically the progression of NSCLC in the 60-80 age range at onset.	"{""explanation"": ""The study examines ground-glass opacities among patients with a history of lung cancer, not specifically the progression of NSCLC in the 60-80 age range at onset."", ""reference"": ""PMID:29432718"", ""snippet"": ""Among patients with previous lung cancer, the malignant potential of subsequent ground-glass opacities (GGOs) on computed tomography remains unknown."", ""supports"": ""NO_EVIDENCE""}"
6356	6185	261	Pick Disease	Pick_Disease.yaml	progression	0	evidence	0	PMID:32333004	REFUTE		It can occur at any age, but most patients develop the disease between the age of 40 to 50 years.	The onset of systemic sclerosis is mentioned to occur between the ages of 40-50, which suggests that many cases do not fall within the 40-65 range exclusively for progression.	"{""explanation"": ""The onset of systemic sclerosis is mentioned to occur between the ages of 40-50, which suggests that many cases do not fall within the 40-65 range exclusively for progression."", ""reference"": ""PMID:32333004"", ""snippet"": ""It can occur at any age, but most patients develop the disease between the age of 40 to 50 years."", ""supports"": ""REFUTE""}"
6357	6185	261	Pick Disease	Pick_Disease.yaml	progression	0	evidence	1	PMID:19415691	REFUTE		Although age of onset varied significantly, the rate of progression appeared linear, independent of age of onset, and similar in all patients.	The disease Niemann-Pick type C progression appears linear and independent of age of onset, suggesting that age between 40-65 is not particularly relevant for progression. This contradicts the statement's implication of age-specific progression.	"{""explanation"": ""The disease Niemann-Pick type C progression appears linear and independent of age of onset, suggesting that age between 40-65 is not particularly relevant for progression. This contradicts the statement's implication of age-specific progression."", ""reference"": ""PMID:19415691"", ""snippet"": ""Although age of onset varied significantly, the rate of progression appeared linear, independent of age of onset, and similar in all patients."", ""supports"": ""REFUTE""}"
6358	6185	261	Pick Disease	Pick_Disease.yaml	progression	0	evidence	2	PMID:10908910	SUPPORT		Patients with disease onset between 40 and 59 years used a walker after 10.2 +/- 5.8 years, whereas those with disease onset between 60 and 79 years used a walker after 5.7 +/- 5.0 years.	There is a clear distinction in disease progression based on age of onset, indicating that progression characteristics might indeed differ across specific age ranges.	"{""explanation"": ""There is a clear distinction in disease progression based on age of onset, indicating that progression characteristics might indeed differ across specific age ranges."", ""reference"": ""PMID:10908910"", ""snippet"": ""Patients with disease onset between 40 and 59 years used a walker after 10.2 +/- 5.8 years, whereas those with disease onset between 60 and 79 years used a walker after 5.7 +/- 5.0 years."", ""supports"": ""SUPPORT""}"
6619	6454	275	Primary_Tonsillar_Lymphoma	Primary_Tonsillar_Lymphoma.yaml	progression	0	evidence	0	PMID:10592134	SUPPORT		We report six cases of primary tonsillar lymphoma with a median patient age of 42 years.	The median age of 42 years falls into the mid-adult range, supporting the age range aspect of the statement.	"{""explanation"": ""The median age of 42 years falls into the mid-adult range, supporting the age range aspect of the statement."", ""reference"": ""PMID:10592134"", ""snippet"": ""We report six cases of primary tonsillar lymphoma with a median patient age of 42 years."", ""supports"": ""SUPPORT""}"
6620	6454	275	Primary_Tonsillar_Lymphoma	Primary_Tonsillar_Lymphoma.yaml	progression	0	evidence	1	PMID:33091144	SUPPORT		An 81-year-old man presented with persistent odynophagia, dysphagia, and obstructive hypertrophic palatine tonsils with purulent exudate.	The patient's age of 81 years supports the elderly aspect of the statement.	"{""explanation"": ""The patient's age of 81 years supports the elderly aspect of the statement."", ""reference"": ""PMID:33091144"", ""snippet"": ""An 81-year-old man presented with persistent odynophagia, dysphagia, and obstructive hypertrophic palatine tonsils with purulent exudate."", ""supports"": ""SUPPORT""}"
6621	6454	275	Primary_Tonsillar_Lymphoma	Primary_Tonsillar_Lymphoma.yaml	progression	0	evidence	2	PMID:29571929	PARTIAL		The Surveillance, Epidemiology and End Results 18 database included 138 pediatric patients with tonsil cancer with an age-adjusted incidence rate of 0.021/100 000 patients per year.	This reference primarily discusses pediatric cases, which does not support the age range of mid-adult to elderly. However, it mentions rapid tonsillar enlargement, which partially supports the statement.	"{""explanation"": ""This reference primarily discusses pediatric cases, which does not support the age range of mid-adult to elderly. However, it mentions rapid tonsillar enlargement, which partially supports the statement."", ""reference"": ""PMID:29571929"", ""snippet"": ""The Surveillance, Epidemiology and End Results 18 database included 138 pediatric patients with tonsil cancer with an age-adjusted incidence rate of 0.021/100 000 patients per year."", ""supports"": ""PARTIAL""}"
6622	6455	275	Primary_Tonsillar_Lymphoma	Primary_Tonsillar_Lymphoma.yaml	progression	1	evidence	0	PMID:16613685	PARTIAL		Most patients with NHL of the tonsil are at early stages, with good prognosis.	The literature supports that primary tonsillar lymphoma is often at an early stage (localized), but it specifically mentions the tonsils and not the oropharynx or nearby lymph nodes.	"{""explanation"": ""The literature supports that primary tonsillar lymphoma is often at an early stage (localized), but it specifically mentions the tonsils and not the oropharynx or nearby lymph nodes."", ""reference"": ""PMID:16613685"", ""snippet"": ""Most patients with NHL of the tonsil are at early stages, with good prognosis."", ""supports"": ""PARTIAL""}"
6623	6456	275	Primary_Tonsillar_Lymphoma	Primary_Tonsillar_Lymphoma.yaml	progression	2	evidence	0	PMID:16613685	PARTIAL		Stage I-II patients received radiochemotherapy-predominant treatment, whereas stage III-IV patients received chemotherapy-predominant treatment.	The study mentions treatment for advanced stages (III-IV) of primary non-Hodgkin's lymphoma of the tonsil but does not explicitly state the potential for systemic spread to distant lymph nodes and organs.	"{""explanation"": ""The study mentions treatment for advanced stages (III-IV) of primary non-Hodgkin's lymphoma of the tonsil but does not explicitly state the potential for systemic spread to distant lymph nodes and organs."", ""reference"": ""PMID:16613685"", ""snippet"": ""Stage I-II patients received radiochemotherapy-predominant treatment, whereas stage III-IV patients received chemotherapy-predominant treatment."", ""supports"": ""PARTIAL""}"
6624	6456	275	Primary_Tonsillar_Lymphoma	Primary_Tonsillar_Lymphoma.yaml	progression	2	evidence	1	PMID:36943852	SUPPORT		HPV-positive tonsil cancer patients with an advanced T stage and a positive surgical margin have a substantial risk of distant metastases.	The reference discusses the risk of distant metastasis in HPV-positive tonsil cancer, supporting the statement about the potential for systemic spread in advanced stages.	"{""explanation"": ""The reference discusses the risk of distant metastasis in HPV-positive tonsil cancer, supporting the statement about the potential for systemic spread in advanced stages."", ""reference"": ""PMID:36943852"", ""snippet"": ""HPV-positive tonsil cancer patients with an advanced T stage and a positive surgical margin have a substantial risk of distant metastases."", ""supports"": ""SUPPORT""}"
6958	6800	290	Rheumatoid Arthritis	Rheumatoid_Arthritis.yaml	progression	0	evidence	0	PMID:15588970	NO_EVIDENCE		It suggests that the term 'early rheumatoid arthritis' is not appropriate and that patients either have established rheumatoid arthritis or an undifferentiated inflammatory arthritis.	This reference argues against the categorization of 'early rheumatoid arthritis' and suggests that RA should be considered either as established or undifferentiated inflammatory arthritis, providing no evidence about the progression specifically at the onset phase.	"{""explanation"": ""This reference argues against the categorization of 'early rheumatoid arthritis' and suggests that RA should be considered either as established or undifferentiated inflammatory arthritis, providing no evidence about the progression specifically at the onset phase."", ""reference"": ""PMID:15588970"", ""snippet"": ""It suggests that the term 'early rheumatoid arthritis' is not appropriate and that patients either have established rheumatoid arthritis or an undifferentiated inflammatory arthritis."", ""supports"": ""NO_EVIDENCE""}"
6959	6800	290	Rheumatoid Arthritis	Rheumatoid_Arthritis.yaml	progression	0	evidence	1	PMID:23926091	NO_EVIDENCE		However, little is known about the characteristics of symptoms at the onset of a disease that eventually progresses to RA	This study highlights the lack of comprehensive knowledge on the characteristics and progression of RA in its earliest phases, thus providing no evidence regarding the progression of RA specifically at the onset phase.	"{""explanation"": ""This study highlights the lack of comprehensive knowledge on the characteristics and progression of RA in its earliest phases, thus providing no evidence regarding the progression of RA specifically at the onset phase."", ""reference"": ""PMID:23926091"", ""snippet"": ""However, little is known about the characteristics of symptoms at the onset of a disease that eventually progresses to RA"", ""supports"": ""NO_EVIDENCE""}"
6960	6801	290	Rheumatoid Arthritis	Rheumatoid_Arthritis.yaml	progression	1	evidence	0	PMID:29039317	SUPPORT		The disease severity increases with increase in the age and reaches to its peak in above 60 years of age (p=0.001). The pattern of progression of RA in the Pakistani patients is almost consistent with other relevant studies conducted on European and European derived populations.	This study indicates that the progression of rheumatoid arthritis increases with age and is most severe in patients above 60. This indirectly supports the statement that progression can be observed in the age range of 30-60, by confirming its increase towards the upper end of this range.	"{""explanation"": ""This study indicates that the progression of rheumatoid arthritis increases with age and is most severe in patients above 60. This indirectly supports the statement that progression can be observed in the age range of 30-60, by confirming its increase towards the upper end of this range."", ""reference"": ""PMID:29039317"", ""snippet"": ""The disease severity increases with increase in the age and reaches to its peak in above 60 years of age (p=0.001). The pattern of progression of RA in the Pakistani patients is almost consistent with other relevant studies conducted on European and European derived populations."", ""supports"": ""SUPPORT""}"
6961	6801	290	Rheumatoid Arthritis	Rheumatoid_Arthritis.yaml	progression	1	evidence	1	PMID:34894251	SUPPORT		Patients with all EORA features were more numerous with age and almost exclusively older than 65 years.	This supports the idea that progression features become more prominent with age. As such, rheumatoid arthritis progression can be inferred for the age range of 30-60.	"{""explanation"": ""This supports the idea that progression features become more prominent with age. As such, rheumatoid arthritis progression can be inferred for the age range of 30-60."", ""reference"": ""PMID:34894251"", ""snippet"": ""Patients with all EORA features were more numerous with age and almost exclusively older than 65 years."", ""supports"": ""SUPPORT""}"
6962	6801	290	Rheumatoid Arthritis	Rheumatoid_Arthritis.yaml	progression	1	evidence	2	PMID:24217093	SUPPORT		A study in the UK found the population minimum prevalence of RA is 1.16% in women and 0.44% in men.	Prevalence indicates the presence of the disease, which includes its progression over time. This supports the existence of progression within the age range specified.	"{""explanation"": ""Prevalence indicates the presence of the disease, which includes its progression over time. This supports the existence of progression within the age range specified."", ""reference"": ""PMID:24217093"", ""snippet"": ""A study in the UK found the population minimum prevalence of RA is 1.16% in women and 0.44% in men."", ""supports"": ""SUPPORT""}"
6963	6801	290	Rheumatoid Arthritis	Rheumatoid_Arthritis.yaml	progression	1	evidence	3	PMID:31899521	SUPPORT		This study demonstrates improvements in inflammatory markers over time in early RA, in line with improved treatment strategies.	The discussion about the progression of clinical and inflammatory markers over time implies that progression happens in various age groups including those within 30-60 years.	"{""explanation"": ""The discussion about the progression of clinical and inflammatory markers over time implies that progression happens in various age groups including those within 30-60 years."", ""reference"": ""PMID:31899521"", ""snippet"": ""This study demonstrates improvements in inflammatory markers over time in early RA, in line with improved treatment strategies."", ""supports"": ""SUPPORT""}"
7007	6821	291	Roifman-syndrome	Roifman-syndrome.yaml	progression	0	evidence	0	PMID:35450878	NO_EVIDENCE		Roifman syndrome is a rare autosomal recessive inherited syndromic immunodeficiency. We wish to add to the available literature by reporting two brothers with clinical, radiological and immunological features of Roifman syndrome, confirmed on whole exome sequencing.	The provided literature does not specify the age range or phase of onset for Roifman syndrome.	"{""explanation"": ""The provided literature does not specify the age range or phase of onset for Roifman syndrome."", ""reference"": ""PMID:35450878"", ""snippet"": ""Roifman syndrome is a rare autosomal recessive inherited syndromic immunodeficiency. We wish to add to the available literature by reporting two brothers with clinical, radiological and immunological features of Roifman syndrome, confirmed on whole exome sequencing."", ""supports"": ""NO_EVIDENCE""}"
7166	6942	297	Schizophrenia	Schizophrenia.yaml	progression	0	evidence	0	PMID:10225329	SUPPORT		In adolescence, preschizophrenics exhibit subtle changes in cognition and affect as well as a variety of anomalous subjective experiences (so-called 'basic symptoms'), suggesting 'trait' status of these features.	This reference indicates that during adolescence, which overlaps with the 15-25 age range, individuals who are preschizophrenic show subtle changes in their thoughts and feelings, aligning with the prodromal phase as described.	"{""explanation"": ""This reference indicates that during adolescence, which overlaps with the 15-25 age range, individuals who are preschizophrenic show subtle changes in their thoughts and feelings, aligning with the prodromal phase as described."", ""reference"": ""PMID:10225329"", ""snippet"": ""In adolescence, preschizophrenics exhibit subtle changes in cognition and affect as well as a variety of anomalous subjective experiences (so-called 'basic symptoms'), suggesting 'trait' status of these features."", ""supports"": ""SUPPORT""}"
7167	6942	297	Schizophrenia	Schizophrenia.yaml	progression	0	evidence	1	PMID:37027026	SUPPORT		EOP patients had significantly more prodromal symptoms with a higher frequency of trouble with thinking, avolition and hallucinations than AOP patients.	This study supports the presence of subtle changes in thinking and behavior during the prodromal phase in early-onset psychosis, which includes patients younger than 18, blending into the 15-25 age range.	"{""explanation"": ""This study supports the presence of subtle changes in thinking and behavior during the prodromal phase in early-onset psychosis, which includes patients younger than 18, blending into the 15-25 age range."", ""reference"": ""PMID:37027026"", ""snippet"": ""EOP patients had significantly more prodromal symptoms with a higher frequency of trouble with thinking, avolition and hallucinations than AOP patients."", ""supports"": ""SUPPORT""}"
7168	6943	297	Schizophrenia	Schizophrenia.yaml	progression	1	evidence	0	PMID:7654792	PARTIAL		Early-onset schizophrenias (< or = 20 years) were compared with a medium-onset group (21 - < 35 years) and a late-onset group (35 - < 60 years) with regard to age and type of onset, early symptom-related course, social development and social course.	The study provides information about the age of onset and early course of schizophrenia that falls within the 16-30 age range but does not specifically address the entire age range spectrum for the onset of the first episode of psychosis.	"{""explanation"": ""The study provides information about the age of onset and early course of schizophrenia that falls within the 16-30 age range but does not specifically address the entire age range spectrum for the onset of the first episode of psychosis."", ""reference"": ""PMID:7654792"", ""snippet"": ""Early-onset schizophrenias (< or = 20 years) were compared with a medium-onset group (21 - < 35 years) and a late-onset group (35 - < 60 years) with regard to age and type of onset, early symptom-related course, social development and social course."", ""supports"": ""PARTIAL""}"
7169	6943	297	Schizophrenia	Schizophrenia.yaml	progression	1	evidence	1	PMID:20021319	SUPPORT		There are progressive frontal changes in males with adolescent-onset psychosis... Ultra high-risk patients who subsequently develop psychosis and first-episode psychosis patients develop significant grey matter reduction in the planum polare, planum temporale and caudal region; a progressive process in the superior temporal gyrus may precede the first expression of florid psychosis.	This literature provides evidence about the progression of schizophrenia, particularly related to brain changes, within the stated age range of 16-30 years during the onset phase of the first episode of psychosis.	"{""explanation"": ""This literature provides evidence about the progression of schizophrenia, particularly related to brain changes, within the stated age range of 16-30 years during the onset phase of the first episode of psychosis."", ""reference"": ""PMID:20021319"", ""snippet"": ""There are progressive frontal changes in males with adolescent-onset psychosis... Ultra high-risk patients who subsequently develop psychosis and first-episode psychosis patients develop significant grey matter reduction in the planum polare, planum temporale and caudal region; a progressive process in the superior temporal gyrus may precede the first expression of florid psychosis."", ""supports"": ""SUPPORT""}"
7170	6943	297	Schizophrenia	Schizophrenia.yaml	progression	1	evidence	2	PMID:10225329	SUPPORT		Prodromal symptoms occur in a substantial proportion of preschizophrenics, followed by a short prepsychotic phase with the crystallization of a psychotic syndrome.	This reference supports the progression of schizophrenia during the onset phase and includes the age group that aligns with the 16-30 age range.	"{""explanation"": ""This reference supports the progression of schizophrenia during the onset phase and includes the age group that aligns with the 16-30 age range."", ""reference"": ""PMID:10225329"", ""snippet"": ""Prodromal symptoms occur in a substantial proportion of preschizophrenics, followed by a short prepsychotic phase with the crystallization of a psychotic syndrome."", ""supports"": ""SUPPORT""}"
7171	6943	297	Schizophrenia	Schizophrenia.yaml	progression	1	evidence	3	PMID:26467909	PARTIAL		Patients with first-episode psychosis were found to have high relapse rates during the first years after illness onset.	While discussing the progression of symptoms and outcomes following the first episode of psychosis, this study does not focus specifically on the age range of 16-30 years.	"{""explanation"": ""While discussing the progression of symptoms and outcomes following the first episode of psychosis, this study does not focus specifically on the age range of 16-30 years."", ""reference"": ""PMID:26467909"", ""snippet"": ""Patients with first-episode psychosis were found to have high relapse rates during the first years after illness onset."", ""supports"": ""PARTIAL""}"
7172	6944	297	Schizophrenia	Schizophrenia.yaml	progression	2	evidence	0	PMID:9789265	SUPPORT		Long-term treatment of patients with chronic schizophrenias requires integration of many therapeutic approaches, co-operation of several professions, and regard for the views of patients and relatives.	The excerpt supports the idea that managing symptoms and functioning in chronic schizophrenia requires long-term management.	"{""explanation"": ""The excerpt supports the idea that managing symptoms and functioning in chronic schizophrenia requires long-term management."", ""reference"": ""PMID:9789265"", ""snippet"": ""Long-term treatment of patients with chronic schizophrenias requires integration of many therapeutic approaches, co-operation of several professions, and regard for the views of patients and relatives."", ""supports"": ""SUPPORT""}"
7173	6944	297	Schizophrenia	Schizophrenia.yaml	progression	2	evidence	1	PMID:23172002	PARTIAL		The evidence shows that although approximately 25% of people with schizophrenia have a poor long-term outcome, few of these show the incremental loss of function that is characteristic of neurodegenerative illnesses.	This statement supports the idea that while a subset of patients experience poor long-term outcomes, most do not have progressive deterioration like in neurodegenerative diseases.	"{""explanation"": ""This statement supports the idea that while a subset of patients experience poor long-term outcomes, most do not have progressive deterioration like in neurodegenerative diseases."", ""reference"": ""PMID:23172002"", ""snippet"": ""The evidence shows that although approximately 25% of people with schizophrenia have a poor long-term outcome, few of these show the incremental loss of function that is characteristic of neurodegenerative illnesses."", ""supports"": ""PARTIAL""}"
